{
  "caseId": "TM-2026-0616-002",
  "jurisdiction": "MY",
  "integrity": {
    "schemaVersion": "1.0.0",
    "sourceSnapshot": "EDL-SNAP-20260616-OK",
    "generatedAt": "2026-07-01T00:00:00"
  },
  "alert": {
    "alertId": "AL-2026-0616-7792",
    "scenarioCode": "SCN110",
    "detectedAt": "2026-07-16T00:00:00",
    "businessDate": "2026-07-16",
    "reasonCodes": [
      "DS24",
      "FREQUENCY_BREACH"
    ],
    "riskScore": 41
  },
  "customer": {
    "customerRef": "CUST-002",
    "type": "Company",
    "name": "Harbourline Distribution Sdn Bhd",
    "riskRating": "Low",
    "kycStatus": "Current",
    "kycLastMaintenance": "2026-05-02",
    "occupation": null,
    "declaredAnnualTurnover": 32000000,
    "declaredSourceOfWealth": "Documented wholesale distribution margin",
    "declaredBusinessNature": "Building materials wholesale distribution",
    "relationshipManager": "Daniel Lim",
    "pepStatus": "None",
    "nationality": "MY"
  },
  "accounts": [
    {
      "accountRef": "ACC-2",
      "type": "Current",
      "currency": "MYR",
      "openedAt": "2021-07-27",
      "cardLimit": null,
      "status": "Active",
      "monthlyCreditTurnover": 9600000,
      "monthlyDebitTurnover": 9200000
    }
  ],
  "transactions": [
    {
      "txnRef": "TXN-A2-000",
      "accountRef": "ACC-2",
      "postedAt": "2026-07-01T10:00:00",
      "valueDate": "2026-07-01",
      "direction": "Credit",
      "amount": 900000,
      "currency": "MYR",
      "channel": "Transfer",
      "country": "MY",
      "counterpartyRef": "CP-21",
      "counterpartyName": "Harbour Distribution Bhd",
      "counterpartyRisk": "Low",
      "description": "Invoice-linked wholesale settlement"
    },
    {
      "txnRef": "TXN-A2-001",
      "accountRef": "ACC-2",
      "postedAt": "2026-07-05T10:00:00",
      "valueDate": "2026-07-05",
      "direction": "Credit",
      "amount": 905000,
      "currency": "MYR",
      "channel": "Transfer",
      "country": "MY",
      "counterpartyRef": "CP-21",
      "counterpartyName": "Harbour Distribution Bhd",
      "counterpartyRisk": "Low",
      "description": "Invoice-linked wholesale settlement"
    },
    {
      "txnRef": "TXN-A2-002",
      "accountRef": "ACC-2",
      "postedAt": "2026-07-09T10:00:00",
      "valueDate": "2026-07-09",
      "direction": "Credit",
      "amount": 910000,
      "currency": "MYR",
      "channel": "Transfer",
      "country": "MY",
      "counterpartyRef": "CP-21",
      "counterpartyName": "Harbour Distribution Bhd",
      "counterpartyRisk": "Low",
      "description": "Invoice-linked wholesale settlement"
    },
    {
      "txnRef": "TXN-A2-003",
      "accountRef": "ACC-2",
      "postedAt": "2026-07-13T10:00:00",
      "valueDate": "2026-07-13",
      "direction": "Credit",
      "amount": 915000,
      "currency": "MYR",
      "channel": "Transfer",
      "country": "MY",
      "counterpartyRef": "CP-21",
      "counterpartyName": "Harbour Distribution Bhd",
      "counterpartyRisk": "Low",
      "description": "Invoice-linked wholesale settlement"
    },
    {
      "txnRef": "TXN-B2-000",
      "accountRef": "ACC-2",
      "postedAt": "2026-07-02T14:00:00",
      "valueDate": "2026-07-02",
      "direction": "Debit",
      "amount": 880000,
      "currency": "MYR",
      "channel": "Transfer",
      "country": "MY",
      "counterpartyRef": "CP-22",
      "counterpartyName": "Kiman Retail Sdn Bhd",
      "counterpartyRisk": "Low",
      "description": "Invoice-linked retail settlement"
    },
    {
      "txnRef": "TXN-B2-001",
      "accountRef": "ACC-2",
      "postedAt": "2026-07-06T14:00:00",
      "valueDate": "2026-07-06",
      "direction": "Debit",
      "amount": 884000,
      "currency": "MYR",
      "channel": "Transfer",
      "country": "MY",
      "counterpartyRef": "CP-22",
      "counterpartyName": "Kiman Retail Sdn Bhd",
      "counterpartyRisk": "Low",
      "description": "Invoice-linked retail settlement"
    },
    {
      "txnRef": "TXN-B2-002",
      "accountRef": "ACC-2",
      "postedAt": "2026-07-10T14:00:00",
      "valueDate": "2026-07-10",
      "direction": "Debit",
      "amount": 888000,
      "currency": "MYR",
      "channel": "Transfer",
      "country": "MY",
      "counterpartyRef": "CP-22",
      "counterpartyName": "Kiman Retail Sdn Bhd",
      "counterpartyRisk": "Low",
      "description": "Invoice-linked retail settlement"
    },
    {
      "txnRef": "TXN-B2-003",
      "accountRef": "ACC-2",
      "postedAt": "2026-07-14T14:00:00",
      "valueDate": "2026-07-14",
      "direction": "Debit",
      "amount": 892000,
      "currency": "MYR",
      "channel": "Transfer",
      "country": "MY",
      "counterpartyRef": "CP-22",
      "counterpartyName": "Kiman Retail Sdn Bhd",
      "counterpartyRisk": "Low",
      "description": "Invoice-linked retail settlement"
    }
  ],
  "ubo": [
    {
      "subjectRef": "U-10",
      "subjectType": "Company",
      "ownershipPercent": 100,
      "qualifyingUBO": true,
      "depth": 0,
      "haltReason": null,
      "providerReference": "CTOS-EXAMPLE-0021"
    },
    {
      "subjectRef": "U-11",
      "subjectType": "Individual",
      "ownershipPercent": 70,
      "qualifyingUBO": true,
      "depth": 1,
      "haltReason": null,
      "providerReference": "CTOS-EXAMPLE-0022"
    }
  ],
  "screening": {
    "watchlistHits": [],
    "pepHits": []
  },
  "searchEvidence": [
    {
      "searchId": "SRCH-2",
      "query": "Harbourline Distribution Sdn Bhd adverse news",
      "searchedAt": "2026-07-16T02:00:00",
      "results": [
        {
          "title": "Harbourline Distribution — company registry extract",
          "url": "https://registry.example.com/company/harbourline",
          "snippet": "Active since 2021, building materials wholesale, no adverse filings.",
          "publishedAt": "2026-04-02",
          "screenshotRef": "SHOT-SRCH-2-0",
          "relevance": "Neutral"
        }
      ]
    }
  ],
  "priorAlerts": []
}